{
  "schema_version": "1.0",
  "created_at": "2025-12-27T00:00:00Z",
  "inputs": {
    "dems": ["data/dem.tif"],
    "aoi": null
  },
  "tiles": ["+47+008"],
  "backend": {
    "name": "ortho4xp",
    "version": "1.40",
    "profile": "compat"
  },
  "options": {
    "quality": "compat",
    "autoortho": false,
    "density": "medium"
  },
  "notes": []
}
